{
  "schema_version": "1.0",
  "timestamp": "2026-09-24T03:05:00Z",
  "event_id": "55ff40d9-92ad-4f59-b514-d9a691eeb2f0",
  "event": {
    "action": "membership.role.changed",
    "category": "authorization",
    "outcome": "success",
    "severity": 7
  },
  "service": { "name": "api", "version": "0.1.0-test" },
  "environment": "staging",
  "tenant": { "id": "11111111-1111-4111-8111-111111111111" },
  "actor": {
    "id": "66666666-6666-4666-8666-666666666666",
    "type": "user",
    "role": "tenant_owner"
  },
  "source": { "ip": "198.51.100.20", "country_code": "JP" },
  "request": {
    "correlation_id": "77777777-7777-4777-8777-777777777777",
    "route": "/v1/memberships/:membershipId/role",
    "method": "PATCH"
  },
  "target": {
    "type": "tenant_membership",
    "id": "88888888-8888-4888-8888-888888888888",
    "role": "tenant_admin"
  },
  "reason_code": "ROLE_CHANGE_APPROVED"
}
