{
  "schema_version": "1.0",
  "timestamp": "2026-09-24T03:00:00Z",
  "event_id": "9f3cf1e9-78e7-4bd3-a7f5-29261c181b63",
  "event": {
    "action": "tenant.cross_access.denied",
    "category": "tenant_isolation",
    "outcome": "failure",
    "severity": 8
  },
  "service": { "name": "api", "version": "0.1.0-test" },
  "environment": "staging",
  "tenant": { "id": "11111111-1111-4111-8111-111111111111" },
  "actor": {
    "id": "22222222-2222-4222-8222-222222222222",
    "type": "user",
    "role": "learner"
  },
  "source": { "ip": "203.0.113.10", "country_code": "JP" },
  "request": {
    "correlation_id": "33333333-3333-4333-8333-333333333333",
    "route": "/v1/courses/:courseId",
    "method": "GET"
  },
  "target": {
    "type": "tenant",
    "id": "44444444-4444-4444-8444-444444444444"
  },
  "reason_code": "TENANT_MEMBERSHIP_MISMATCH"
}
